{
  "$schema": "https://json-schema.org/draft/2020-12/schema",
  "title": "feishu_form_fill_submit",
  "description": "Phase 2 of filling the built-in preset Feishu questionnaire. ONLY call this AFTER `feishu_form_fill_prepare` returned draft answers and a human has approved or corrected them with no new free-form supplement. If the user adds new data in natural language, rerun phase 1 instead. You MUST pass the exact `draft_session_id` from phase 1.",
  "type": "object",
  "additionalProperties": false,
  "required": ["draft_session_id"],
  "properties": {
    "draft_session_id": {
      "type": "string",
      "description": "REQUIRED. The exact draft_session_id returned by feishu_form_fill_prepare. This is a single-use token that expires after DRAFT_SESSION_TTL_SEC (default 1800s).",
      "examples": [
        "8da6a3c7-a79f-41c3-b381-885310a6db8c"
      ]
    },
    "human_confirmation_notes": {
      "type": "string",
      "description": "Optional human review notes to apply before submission."
    },
    "confirmed_answers": {
      "type": "array",
      "description": "Optional field-level overrides for answers returned by phase 1.",
      "items": {
        "type": "object",
        "additionalProperties": false,
        "properties": {
                "index": {
                  "type": "integer",
                  "description": "Target field index from the phase-1 draft."
                },
                "field_key": {
                  "type": "string",
                  "description": "Stable internal key from the phase-1 draft, such as name / attendance_time / attendance_count."
                },
                "field_label": {
                  "type": "string",
                  "description": "Target field label from the phase-1 draft."
          },
          "confirmed_value": {
            "type": "string",
            "description": "Human-confirmed final answer."
          },
          "normalized_values": {
            "type": "array",
            "items": {
              "type": "string"
            },
            "description": "Structured option values for single-select or multi-select fields."
          },
          "clear_value": {
            "type": "boolean",
            "description": "Set true to intentionally clear a drafted answer."
          }
        }
      }
    },
    "field_ids": {
      "type": "object",
      "additionalProperties": false,
      "description": "Optional Feishu form field id mapping for rebuilt or non-preset forms. Omit to use the built-in preset mapping.",
      "properties": {
        "name": {
          "type": "string",
          "description": "Feishu field id for 姓名, for example fldRiWDs6J."
        },
        "attendance_time": {
          "type": "string",
          "description": "Feishu field id for 参会时间, for example fldMwK92Ml."
        },
        "attendance_count": {
          "type": "string",
          "description": "Feishu field id for 人数/参会人数, for example fldROl771Y."
        }
      }
    },
    "allowed_domains": {
      "type": "array",
      "default": ["*.feishu.cn", "*.larksuite.com", "*.larkoffice.com"],
      "items": {
        "type": "string"
      }
    },
    "headless": {
      "type": "boolean",
      "description": "Whether to run the browser in headless mode."
    },
    "max_steps": {
      "type": "integer",
      "minimum": 1,
      "maximum": 120,
      "default": 35
    },
    "timeout_sec": {
      "type": "integer",
      "minimum": 30,
      "maximum": 3600,
      "default": 900
    },
    "use_vision": {
      "type": "string",
      "enum": ["auto", "always", "never"],
      "default": "auto"
    },
    "llm": {
      "type": "object",
      "additionalProperties": false,
      "properties": {
        "base_url": { "type": "string" },
        "api_key": { "type": "string" },
        "model": { "type": "string" },
        "temperature": { "type": "number", "minimum": 0, "maximum": 2 }
      }
    },
    "auth": {
      "type": "object",
      "additionalProperties": false,
      "properties": {
        "profile_id": {
          "type": "string",
          "description": "Server-side stored auth profile id. If omitted, the service falls back to FEISHU_DEFAULT_PROFILE_ID."
        },
        "storage_state": {
          "type": "object",
          "description": "Playwright storage state JSON object for an already logged-in Feishu session."
        },
        "storage_state_path": {
          "type": "string",
          "description": "Path to an existing Feishu storage state file inside the container."
        },
        "sensitive_data": {
          "type": "object",
          "description": "Optional Browser Use sensitive_data payload for login assistance."
        }
      }
    }
  }
}
