{
  "draft_session_id": "8da6a3c7-a79f-41c3-b381-885310a6db8c",
  "human_confirmation_notes": "信息已确认，请正式提交。",
  "confirmed_answers": [
    {
      "field_key": "name",
      "field_label": "姓名",
      "confirmed_value": "张三"
    },
    {
      "field_key": "attendance_time",
      "field_label": "参会时间",
      "confirmed_value": "2026-05-08"
    },
    {
      "field_key": "attendance_count",
      "field_label": "参会人数",
      "confirmed_value": "3"
    }
  ],
  "field_ids": {
    "name": "fldRiWDs6J",
    "attendance_time": "fldMwK92Ml",
    "attendance_count": "fldROl771Y"
  },
  "timeout_sec": 900,
  "max_steps": 35
}
